{
  "$schema": "http://json-schema.org/draft-04/schema#",
  "type": "object",
  "properties": {
    "Company": {
      "type": "string"
    },
    "Item": {
      "type": "string"
    },
    "price": {
      "type": "number"
    },
    "description": {
      "type": "string"
    }
  },
  "required": [
  
  ]
}